{
  "$schema": "https://json-schema.org/draft/2020-12/schema",
  "$id": "https://github.com/dcc-mcp/marketplace/schemas/marketplace-v1.schema.json",
  "title": "DCC-MCP Marketplace Catalog v1",
  "type": "object",
  "required": ["name", "schemaVersion", "version", "skills"],
  "properties": {
    "$schema": { "type": "string", "format": "uri" },
    "name": {
      "type": "string",
      "pattern": "^[a-z0-9][a-z0-9-]*$"
    },
    "schemaVersion": {
      "const": "1"
    },
    "version": {
      "$ref": "#/$defs/semver"
    },
    "interface": {
      "type": "object",
      "required": ["displayName", "description"],
      "properties": {
        "displayName": { "type": "string", "minLength": 1 },
        "description": { "type": "string", "minLength": 1 }
      },
      "additionalProperties": false
    },
    "installRoot": {
      "type": "string",
      "pattern": "^~/.dcc-mcp/marketplace/\\{dcc\\}/\\{name\\}$"
    },
    "skills": {
      "type": "array",
      "minItems": 1,
      "items": { "$ref": "#/$defs/skillEntry" }
    }
  },
  "additionalProperties": false,
  "$defs": {
    "semver": {
      "type": "string",
      "pattern": "^(0|[1-9][0-9]*)\\.(0|[1-9][0-9]*)\\.(0|[1-9][0-9]*)(?:-[0-9A-Za-z-]+(?:\\.[0-9A-Za-z-]+)*)?(?:\\+[0-9A-Za-z-]+(?:\\.[0-9A-Za-z-]+)*)?$"
    },
    "skillEntry": {
      "type": "object",
      "required": [
        "name",
        "description",
        "version",
        "dcc",
        "tags",
        "category",
        "maintainer",
        "minCoreVersion",
        "source",
        "policy"
      ],
      "properties": {
        "name": {
          "type": "string",
          "pattern": "^[a-z0-9][a-z0-9-]*$"
        },
        "description": { "type": "string", "minLength": 1 },
        "version": { "$ref": "#/$defs/semver" },
        "dcc": {
          "type": "array",
          "minItems": 1,
          "uniqueItems": true,
          "items": {
            "type": "string",
            "pattern": "^[a-z0-9][a-z0-9_-]*$"
          }
        },
        "tags": {
          "type": "array",
          "minItems": 1,
          "uniqueItems": true,
          "items": {
            "type": "string",
            "pattern": "^[a-z0-9][a-z0-9-]*$"
          }
        },
        "category": {
          "enum": ["Skills", "Asset Providers", "Studio", "Infrastructure"]
        },
        "maintainer": { "type": "string", "minLength": 1 },
        "minCoreVersion": { "$ref": "#/$defs/semver" },
        "source": { "$ref": "#/$defs/source" },
        "package": { "$ref": "#/$defs/package" },
        "policy": { "$ref": "#/$defs/policy" },
        "requires": { "$ref": "#/$defs/requires" },
        "license": { "type": "string", "minLength": 1 },
        "docs": { "type": "string", "format": "uri" },
        "icon": { "type": "string", "format": "uri" },
        "showcase": {
          "type": "string",
          "pattern": "^[A-Za-z0-9][A-Za-z0-9._-]*(/[A-Za-z0-9][A-Za-z0-9._-]*)*\\.(png|jpg|jpeg|webp|avif|gif)$"
        },
        "lifecycle": {
          "enum": ["active", "deprecated", "experimental"]
        },
        "assetContract": {
          "enum": ["descriptor-v1"]
        },
        "replacedBy": {
          "type": "string",
          "pattern": "^[a-z0-9][a-z0-9-]*$"
        },
        "examplePrompts": { "$ref": "#/$defs/examplePrompts" },
        "recovery": { "$ref": "#/$defs/recovery" },
        "undo": { "$ref": "#/$defs/undo" }
      },
      "allOf": [
        {
          "if": {
            "properties": { "lifecycle": { "const": "deprecated" } },
            "required": ["lifecycle"]
          },
          "then": { "required": ["replacedBy"] }
        }
      ],
      "additionalProperties": false
    },
    "source": {
      "type": "object",
      "required": ["type", "url"],
      "properties": {
        "type": { "enum": ["git", "zip"] },
        "url": { "type": "string", "format": "uri" },
        "ref": { "type": "string", "minLength": 1 },
        "sha256": {
          "type": "string",
          "pattern": "^(?:sha256:)?[a-fA-F0-9]{64}$"
        },
        "skillRoots": {
          "type": "array",
          "minItems": 1,
          "uniqueItems": true,
          "items": {
            "type": "string",
            "pattern": "^(?!/)(?!.*(?:^|/)\\.\\.(?:/|$))[A-Za-z0-9._/-]+$"
          }
        }
      },
      "allOf": [
        {
          "if": { "properties": { "type": { "const": "git" } } },
          "then": { "required": ["ref"] }
        },
        {
          "if": { "properties": { "type": { "const": "zip" } } },
          "then": { "required": ["sha256"] }
        }
      ],
      "additionalProperties": false
    },
    "package": {
      "type": "object",
      "required": ["format", "skills"],
      "properties": {
        "format": {
          "enum": ["agent-plugin", "skill-bundle"]
        },
        "skills": {
          "type": "array",
          "minItems": 1,
          "uniqueItems": true,
          "items": {
            "type": "string",
            "pattern": "^[a-z0-9][a-z0-9-]*$"
          }
        }
      },
      "allOf": [
        {
          "if": { "properties": { "format": { "const": "skill-bundle" } } },
          "then": { "properties": { "skills": { "minItems": 2 } } }
        }
      ],
      "additionalProperties": false
    },
    "policy": {
      "type": "object",
      "required": ["installation"],
      "properties": {
        "installation": {
          "enum": ["available", "installed_by_default", "not_available"]
        }
      },
      "additionalProperties": false
    },
    "examplePrompts": {
      "type": "array",
      "minItems": 1,
      "items": {
        "type": "string",
        "minLength": 8
      }
    },
    "recovery": {
      "type": "array",
      "minItems": 1,
      "items": { "$ref": "#/$defs/recoveryRule" }
    },
    "recoveryRule": {
      "type": "object",
      "required": ["on", "next"],
      "properties": {
        "on": { "type": "string", "minLength": 1 },
        "next": { "type": "string", "minLength": 8 }
      },
      "additionalProperties": false
    },
    "undo": {
      "type": "string",
      "enum": ["single-step", "none", "manual"]
    },
    "requires": {
      "type": "object",
      "properties": {
        "env": {
          "type": "array",
          "uniqueItems": true,
          "items": {
            "type": "string",
            "pattern": "^[A-Z][A-Z0-9_]*$"
          }
        },
        "bins": {
          "type": "array",
          "uniqueItems": true,
          "items": { "type": "string", "minLength": 1 }
        },
        "python": {
          "type": "array",
          "uniqueItems": true,
          "items": { "type": "string", "minLength": 1 }
        },
        "skills": {
          "type": "array",
          "uniqueItems": true,
          "items": {
            "type": "string",
            "pattern": "^[a-z0-9][a-z0-9-]*$"
          }
        }
      },
      "additionalProperties": false
    }
  }
}
