{
  "name": "dcc-mcp-official",
  "schemaVersion": "1",
  "version": "1.15.4",
  "interface": {
    "displayName": "DCC-MCP Official Marketplace",
    "description": "Curated DCC-MCP plugins, multi-skill bundles, asset providers, and Skills."
  },
  "installRoot": "~/.dcc-mcp/marketplace/{dcc}/{name}",
  "skills": [
    {
      "name": "dcc-mcp-maya-mgear",
      "description": "mGear Shifter rigging integration for DCC-MCP — inspect, build, and manage mGear rigs",
      "version": "0.4.3",
      "dcc": ["maya"],
      "tags": ["skills", "maya", "rigging", "mgear"],
      "category": "Skills",
      "maintainer": "dcc-mcp",
      "minCoreVersion": "0.18.0",
      "source": {
        "type": "git",
        "url": "https://github.com/dcc-mcp/dcc-mcp-maya-mgear",
        "ref": "406e8f90f3528ed1206a36cd0b80e904270179a0",
        "skillRoots": ["skill/maya-mgear", "skill/mgear-import-to-scene"]
      },
      "package": {
        "format": "skill-bundle",
        "skills": ["maya-mgear", "mgear-import-to-scene"]
      },
      "docs": "https://github.com/dcc-mcp/dcc-mcp-maya-mgear#readme",
      "showcase": "docs/images/dcc-mcp-maya-mgear-showcase.webp",
      "policy": {
        "installation": "available"
      },
      "examplePrompts": ["Build a mGear Shifter biped rig from the current Maya guide and report every component it created", "Inspect which mGear modules and versions are loaded in this Maya session", "Import the exported mGear rig back into the scene and verify the control hierarchy"],
      "recovery": [
        {
          "on": "mGear is not importable in the running Maya interpreter",
          "next": "dcc-mcp-cli marketplace inspect dcc-mcp-maya-mgear"
        },
        {
          "on": "guide or component validation fails before the build starts",
          "next": "run the mgear inspection tool to list the offending guide nodes, fix them in Maya, then rebuild"
        },
        {
          "on": "a partially built rig is left in the scene after a failed build",
          "next": "undo back to the pre-build state with a single Maya undo step, delete the leftover rig group, then rebuild"
        }
      ],
      "undo": "single-step"
    },
    {
      "name": "dcc-mcp-maya-advancedskeleton",
      "description": "AdvancedSkeleton rigging for DCC-MCP — inspect templates, create or import FitSkeletons, and build or rebuild Maya rigs",
      "version": "0.1.1",
      "dcc": ["maya"],
      "tags": ["skills", "domain", "maya", "rigging", "advancedskeleton", "fitskeleton"],
      "category": "Skills",
      "maintainer": "dcc-mcp",
      "minCoreVersion": "0.18.0",
      "source": {
        "type": "git",
        "url": "https://github.com/dcc-mcp/dcc-mcp-maya-advancedskeleton",
        "ref": "2e6a6dcd350a3e35d89b1a4c7870d2908103ea15",
        "skillRoots": ["skill/maya-advancedskeleton"]
      },
      "docs": "https://github.com/dcc-mcp/dcc-mcp-maya-advancedskeleton#readme",
      "showcase": "docs/images/maya-advancedskeleton-showcase.webp",
      "policy": {
        "installation": "available"
      },
      "examplePrompts": ["List the AdvancedSkeleton templates available in this Maya session", "Create a FitSkeleton from the selected biped template and report the joints it placed", "Rebuild the existing AdvancedSkeleton rig after I move the FitSkeleton joints"],
      "recovery": [
        {
          "on": "AdvancedSkeleton is not installed or not importable in Maya",
          "next": "dcc-mcp-cli marketplace inspect dcc-mcp-maya-advancedskeleton"
        },
        {
          "on": "no FitSkeleton or template exists in the scene yet",
          "next": "create a FitSkeleton from a template first, then retry the rig build"
        },
        {
          "on": "the rebuild produced a duplicate or broken rig",
          "next": "undo the rebuild with a single Maya undo step, delete the duplicate rig group, then rebuild from the FitSkeleton"
        }
      ],
      "undo": "single-step"
    },
    {
      "name": "dcc-mcp-maya-procedural-architecture",
      "description": "Generate six seeded Maya house styles with realistic or stylized Arnold materials, cancellable progress, and optional CC0 HDR lighting",
      "version": "1.1.0",
      "dcc": ["maya"],
      "tags": ["skills", "domain", "maya", "bifrost", "architecture", "procedural-modeling", "arnold", "pbr", "hdri", "stylized"],
      "category": "Skills",
      "maintainer": "dcc-mcp",
      "minCoreVersion": "0.19.0",
      "source": {
        "type": "git",
        "url": "https://github.com/dcc-mcp/dcc-mcp-maya-procedural-architecture",
        "ref": "73938bbc7b21b2e6b7e5e5d79a5d44d75a106cf7",
        "skillRoots": ["skill/maya-procedural-architecture"]
      },
      "policy": {
        "installation": "available"
      },
      "requires": {
        "skills": ["maya-bifrost", "maya-materials", "maya-render", "ambientcg-assets"]
      },
      "license": "MIT",
      "docs": "https://github.com/dcc-mcp/dcc-mcp-maya-procedural-architecture#readme",
      "showcase": "docs/showcase/maya-bifrost-random-houses.gif",
      "examplePrompts": ["Generate three seeded suburban house variants in Maya with Arnold materials and report the mesh counts", "Build one stylized cottage with a CC0 HDRI from ambientCG and frame it with the existing camera", "Cancel the running house generation and tell me what was already created"],
      "recovery": [
        {
          "on": "Bifrost or Arnold is unavailable in this Maya version",
          "next": "dcc-mcp-cli marketplace inspect dcc-mcp-maya-procedural-architecture"
        },
        {
          "on": "HDR download fails or ambientCG is unreachable",
          "next": "fall back to the built-in studio HDR preset and re-run the same seed"
        },
        {
          "on": "generation was cancelled part way and left stray geometry",
          "next": "undo with a single Maya undo step, delete the leftover house group, then re-run with a new seed"
        }
      ],
      "undo": "single-step"
    },
    {
      "name": "dcc-ui-qt-inspector",
      "description": "Read-only Qt inspection for DCC-MCP CUA and UI Control selector discovery",
      "version": "0.1.0",
      "dcc": ["maya", "houdini", "nuke", "substance", "substance3d_designer", "substance3d_painter", "mari", "katana"],
      "tags": ["skills", "ui", "ui-control", "cua", "dcc-cua", "qt", "pyside", "pyqt", "inspection", "infrastructure"],
      "category": "Infrastructure",
      "maintainer": "dcc-mcp",
      "minCoreVersion": "0.20.0",
      "source": {
        "type": "git",
        "url": "https://github.com/dcc-mcp/dcc-ui-qt-inspector",
        "ref": "bca538cb6ffb372025bbe400bed7ee61e60617b9",
        "skillRoots": ["skill/qt-ui-inspector"]
      },
      "docs": "https://github.com/dcc-mcp/dcc-ui-qt-inspector#readme",
      "showcase": "docs/images/dcc-ui-qt-inspector-showcase.webp",
      "policy": {
        "installation": "available"
      },
      "examplePrompts": ["Inspect the Qt widget tree of the running Houdini session and list every dialog title", "Find a stable selector for the render settings Apply button in this DCC", "Report which Qt widgets are currently visible under the main window"],
      "recovery": [
        {
          "on": "no Qt binding is available in the target DCC process",
          "next": "dcc-mcp-cli marketplace inspect dcc-ui-qt-inspector"
        },
        {
          "on": "the widget tree is empty or the target window is not found",
          "next": "confirm the DCC window is open and re-run the inspection; it is read-only so nothing needs to be undone"
        }
      ],
      "undo": "none"
    },
    {
      "name": "dcc-ui-qt-actions",
      "description": "Structured Qt actions for DCC-MCP CUA and UI Control workflows backed by dcc-cua",
      "version": "0.1.2",
      "dcc": ["maya", "houdini", "nuke", "substance", "substance3d_designer", "substance3d_painter", "mari", "katana"],
      "tags": ["skills", "ui", "ui-control", "cua", "dcc-cua", "qt", "pyside", "pyqt", "automation", "infrastructure"],
      "category": "Infrastructure",
      "maintainer": "dcc-mcp",
      "minCoreVersion": "0.20.0",
      "source": {
        "type": "git",
        "url": "https://github.com/dcc-mcp/dcc-ui-qt-actions",
        "ref": "9c16447100d2c5883883ec175a61e4bcd8839f0d",
        "skillRoots": ["skill/qt-ui-actions"]
      },
      "docs": "https://github.com/dcc-mcp/dcc-ui-qt-actions#readme",
      "showcase": "docs/images/dcc-ui-qt-actions-showcase.webp",
      "policy": {
        "installation": "available"
      },
      "examplePrompts": ["Click the Apply button in the Houdini render settings dialog and report the resulting widget state", "Set the frame range fields in the open Qt dialog and verify the values were accepted", "Drive the Nuke write node creation dialog through structured Qt actions"],
      "recovery": [
        {
          "on": "the target selector no longer resolves in the live UI",
          "next": "dcc-mcp-cli marketplace inspect dcc-ui-qt-inspector"
        },
        {
          "on": "the action was applied but the widget state did not change",
          "next": "re-inspect the widget tree to find the updated selector, then retry the single action"
        },
        {
          "on": "an action sequence left the dialog in a partially edited state",
          "next": "restore the dialog to its saved settings from the DCC preferences, then undo the field edits and re-run"
        }
      ],
      "undo": "manual"
    },
    {
      "name": "dcc-ui-workflow-memory",
      "description": "Structured workflow memory for DCC-MCP CUA and UI Control automation backed by dcc-cua",
      "version": "0.1.1",
      "dcc": ["maya", "houdini", "nuke", "substance", "substance3d_designer", "substance3d_painter", "mari", "katana"],
      "tags": ["skills", "ui", "ui-control", "cua", "dcc-cua", "workflow", "memory", "automation", "selectors", "infrastructure"],